{
  "schema_version": "0.1",
  "generated_at": "2026-06-02T07:05:25.879898Z",
  "source": {
    "spreadsheet_id": "1gp3jl_DyB8kvxHO7m4YjsCPbFTPGi-XKyqPhGAlTZ60",
    "spreadsheet_url": "https://docs.google.com/spreadsheets/d/1gp3jl_DyB8kvxHO7m4YjsCPbFTPGi-XKyqPhGAlTZ60/edit?ouid=112662517307801676490",
    "title": "[Day 1] 1.0 (from 20250707)",
    "source_artifacts": {
      "live_document_ontology_mapping": "/Users/kangmin/Documents/excel-workbook-editing/review-packages/sheets-bridge/live-inspections/20260602-day1-1-0/live-document-ontology-mapping.json",
      "live_evidence_package": "/Users/kangmin/Documents/excel-workbook-editing/review-packages/sheets-bridge/live-inspections/20260602-day1-1-0/live-evidence-package.json",
      "live_action_contracts": "/Users/kangmin/Documents/excel-workbook-editing/review-packages/sheets-bridge/live-inspections/20260602-day1-1-0/live-action-contracts.json",
      "live_semantic_proposal_validation": "/Users/kangmin/Documents/excel-workbook-editing/review-packages/sheets-bridge/live-inspections/20260602-day1-1-0/live-semantic-proposal-validation.json"
    }
  },
  "authority": {
    "source_document": "live_google_sheet",
    "graph_status": "accepted_document_structure_only",
    "semantic_graph_promotion": "not_performed",
    "accepted_semantic_concepts": 0,
    "shared_ontology_updates": 0,
    "formula_result_authority": "not_established"
  },
  "method": {
    "name": "connected_sheets_validated_graph_assembly",
    "authority": "accepted_graph_projection_with_carry_forward_review_queue",
    "decision_policy": "Assemble only accepted document-structure ontology nodes, accepted document relations, and accepted deterministic evidence into the graph body. Blocked semantic proposal validation results remain carry-forward review items."
  },
  "graph": {
    "nodes": [
      {
        "id": "node_workbook",
        "type": "workbook_document",
        "ontology_class": "WorkbookDocument",
        "status": "accepted",
        "label": "[Day 1] 1.0 (from 20250707)",
        "properties": {
          "sheet_count": 52,
          "hidden_sheet_count": 3,
          "view_state_risk_surface_count": 40,
          "formula_signal_count": 335,
          "candidate_block_count": 539,
          "candidate_region_count": 539
        },
        "evidence_refs": [
          "live-evidence-package.json"
        ],
        "source_artifact_refs": [
          "live-document-ontology-mapping",
          "live-evidence-package"
        ]
      },
      {
        "id": "node_accepted_evidence_body",
        "type": "accepted_evidence_body",
        "ontology_class": "EvidenceBody",
        "status": "accepted",
        "label": "Accepted deterministic evidence",
        "properties": {
          "accepted_gate_count": 43,
          "accepted_target_count": 4
        },
        "evidence_refs": [
          "accepted_evidence"
        ],
        "source_artifact_refs": [
          "live-document-ontology-mapping",
          "live-evidence-package"
        ]
      },
      {
        "id": "node_pipeline_pipeline_24_0102_same_sheet_range_24_0102",
        "type": "calculation_pipeline",
        "ontology_class": "CalculationPipeline",
        "status": "accepted",
        "label": "24_0102 formula surface",
        "properties": {
          "pipeline_id": "pipeline_24_0102_same_sheet_range_24_0102",
          "role": "calculation",
          "confidence": 0.76,
          "input_label": "(2023. 12.26~ 2024. 01.01)",
          "output_label": "24_0102 formula surface"
        },
        "evidence_refs": [
          "pipeline_24_0102_same_sheet_range_24_0102"
        ],
        "source_artifact_refs": [
          "live-document-ontology-mapping",
          "live-evidence-package"
        ]
      },
      {
        "id": "node_pipeline_pipeline_24_0108_same_sheet_range_24_0108",
        "type": "calculation_pipeline",
        "ontology_class": "CalculationPipeline",
        "status": "accepted",
        "label": "24_0108 formula surface",
        "properties": {
          "pipeline_id": "pipeline_24_0108_same_sheet_range_24_0108",
          "role": "calculation",
          "confidence": 0.76,
          "input_label": "1월 목표",
          "output_label": "24_0108 formula surface"
        },
        "evidence_refs": [
          "pipeline_24_0108_same_sheet_range_24_0108"
        ],
        "source_artifact_refs": [
          "live-document-ontology-mapping",
          "live-evidence-package"
        ]
      },
      {
        "id": "node_pipeline_pipeline_24_0115_same_sheet_range_24_0115",
        "type": "calculation_pipeline",
        "ontology_class": "CalculationPipeline",
        "status": "accepted",
        "label": "24_0115 formula surface",
        "properties": {
          "pipeline_id": "pipeline_24_0115_same_sheet_range_24_0115",
          "role": "calculation",
          "confidence": 0.76,
          "input_label": "상반기 목표 매출/손익",
          "output_label": "24_0115 formula surface"
        },
        "evidence_refs": [
          "pipeline_24_0115_same_sheet_range_24_0115"
        ],
        "source_artifact_refs": [
          "live-document-ontology-mapping",
          "live-evidence-package"
        ]
      }
    ],
    "relations": [
      {
        "id": "rel_workbook_has_accepted_evidence",
        "type": "has_evidence_body",
        "from": "node_workbook",
        "to": "node_accepted_evidence_body",
        "status": "accepted",
        "properties": {},
        "evidence_refs": [
          "live-evidence-package.json"
        ],
        "source_artifact_refs": [
          "live-document-ontology-mapping"
        ]
      },
      {
        "id": "rel_accepted_evidence_contains_node_pipeline_pipeline_24_0102_same_sheet_range_24_0102",
        "type": "contains_accepted_pipeline",
        "from": "node_accepted_evidence_body",
        "to": "node_pipeline_pipeline_24_0102_same_sheet_range_24_0102",
        "status": "accepted",
        "properties": {},
        "evidence_refs": [
          "pipeline_24_0102_same_sheet_range_24_0102"
        ],
        "source_artifact_refs": [
          "live-document-ontology-mapping"
        ]
      },
      {
        "id": "rel_accepted_evidence_contains_node_pipeline_pipeline_24_0108_same_sheet_range_24_0108",
        "type": "contains_accepted_pipeline",
        "from": "node_accepted_evidence_body",
        "to": "node_pipeline_pipeline_24_0108_same_sheet_range_24_0108",
        "status": "accepted",
        "properties": {},
        "evidence_refs": [
          "pipeline_24_0108_same_sheet_range_24_0108"
        ],
        "source_artifact_refs": [
          "live-document-ontology-mapping"
        ]
      },
      {
        "id": "rel_accepted_evidence_contains_node_pipeline_pipeline_24_0115_same_sheet_range_24_0115",
        "type": "contains_accepted_pipeline",
        "from": "node_accepted_evidence_body",
        "to": "node_pipeline_pipeline_24_0115_same_sheet_range_24_0115",
        "status": "accepted",
        "properties": {},
        "evidence_refs": [
          "pipeline_24_0115_same_sheet_range_24_0115"
        ],
        "source_artifact_refs": [
          "live-document-ontology-mapping"
        ]
      }
    ],
    "semantic_nodes": [],
    "semantic_relations": [],
    "data_views": []
  },
  "carry_forward": {
    "document_review_queue": [
      {
        "id": "review_external_dep_fc_data_A5",
        "status": "blocked_until_source_acl_and_broker_allowlist",
        "target_node_id": null,
        "reason": "external_source_authority_blocker",
        "evidence_refs": [
          "external_dep_fc_data_A5",
          "sampled_region_fc_data_inspect_values_window_001"
        ]
      },
      {
        "id": "review_external_importrange_source_authority",
        "status": "requires_human_or_broker_policy_action",
        "target_node_id": null,
        "reason": "permission_or_authority_blocker",
        "evidence_refs": [
          "external_dep_fc_data_A5"
        ]
      },
      {
        "id": "review_formula_error_surfaces",
        "status": "requires_formula_result_review",
        "target_node_id": null,
        "reason": "formula_result_authority_gap",
        "evidence_refs": [
          "action_error_sampled_region_fc_data_inspect_values_window_002",
          "action_error_sampled_region_fc_data_inspect_values_window_009",
          "action_error_sampled_region_fc_data_inspect_values_window_010"
        ]
      },
      {
        "id": "review_remaining_bounded_read_queue",
        "status": "pending_bounded_sampling",
        "target_node_id": null,
        "reason": "coverage_gap",
        "evidence_refs": [
          "read_26_0518_next_window",
          "read_26_0511_next_window",
          "read_26_0504_next_window",
          "read_26_0427_next_window",
          "read_26_0420_next_window",
          "read_26_0413_next_window",
          "read_26_0406_next_window",
          "read_26_0330_next_window",
          "read_26_0323_next_window",
          "read_26_0316_next_window",
          "read_26_0309_next_window",
          "read_26_0302_next_window"
        ]
      },
      {
        "id": "review_blocked_gate_results",
        "status": "blocked",
        "target_node_id": null,
        "reason": "blocked_deterministic_gates",
        "evidence_refs": [
          "result_gate_target_external_source_external_dep_fc_data_a5_external_source_authority",
          "result_gate_target_pipeline_pipeline_25_0707_cross_sheet_range_fc_data_formula_error_reconciliation",
          "result_gate_target_pipeline_pipeline_25_0714_cross_sheet_range_fc_data_formula_error_reconciliation",
          "result_gate_target_pipeline_pipeline_25_0721_cross_sheet_range_fc_data_formula_error_reconciliation",
          "result_gate_target_pipeline_pipeline_25_0728_cross_sheet_range_fc_data_formula_error_reconciliation",